{
  "dataVersion": 1,
  "feedUrls": [
    "https://rss.pdrl.fm/5858fc/feeds.megaphone.fm/thisishistory",
    "https://feeds.megaphone.fm/thisishistory"
  ],
  "id": "ceaca98eba8a",
  "playlists": [
    "the_tudors",
    "dynasty",
    "spinoffs",
    "extras"
  ],
  "showEpisodeThumbnail": false,
  "yearGroupedEpisodes": false
}
